{
  "$schema": "https://json-schema.org/draft/2020-12/schema",
  "$id": "https://cloudcaptain.io/schema/lesson.schema.json",
  "title": "CloudCaptain lesson metadata (lesson.json)",
  "type": "object",
  "required": ["id", "title", "motto", "type", "status", "minutes", "langs", "prereqs", "outputs", "tests"],
  "additionalProperties": false,
  "properties": {
    "$schema": { "type": "string" },
    "id": { "type": "string", "pattern": "^[a-z0-9-]+/[a-z0-9-]+$", "description": "<phase slug>/<lesson slug>. The lesson slug must equal the folder name without its two-digit prefix." },
    "title": { "type": "string", "maxLength": 80 },
    "short": { "type": "string", "maxLength": 32, "description": "Optional short label for the sidebar." },
    "motto": { "type": "string", "maxLength": 140, "description": "One line stating the core idea. Rendered under the title." },
    "type": { "enum": ["Build", "Learn"] },
    "status": { "enum": ["draft", "preview", "published"], "description": "draft: excluded from production builds. preview: built but unlisted. published: live." },
    "minutes": { "type": "integer", "minimum": 15, "maximum": 180 },
    "langs": { "type": "array", "minItems": 1, "items": { "enum": ["python", "bash", "go", "typescript", "yaml"] } },
    "prereqs": { "type": "array", "items": { "type": "string", "pattern": "^[a-z0-9-]+/[a-z0-9-]+$" } },
    "tools": { "type": "array", "items": { "type": "string" }, "description": "Real tools used in Use It (docker, kubectl, terraform...)." },
    "reference": { "type": "array", "items": { "type": "string", "pattern": "^/docs/" }, "description": "Reference-layer docs this lesson builds on; each must exist under website/docs." },
    "outputs": { "type": "array", "items": { "type": "string", "pattern": "^(prompt|skill|agent)-[a-z0-9-]+\\.md$|^mcp-[a-z0-9-]+/$" }, "description": "Artifacts in outputs/ produced by Ship It." },
    "tests": {
      "type": "object",
      "description": "One command per language, run from the lesson folder by scripts/run-lesson-tests.mjs.",
      "additionalProperties": { "type": "string" }
    },
    "smoke": { "type": "string", "description": "End-to-end check of Build It + Use It with the real tools, run on Linux CI by scripts/run-lesson-tests.mjs --smoke (lesson-smoke.yml). Sets last_verified when it passes." },
    "last_verified": { "type": "string", "pattern": "^[0-9]{4}-[0-9]{2}-[0-9]{2}$", "description": "Date the commands were last run against current tool versions." }
  }
}
